{
  "manifest_version": "v2.0.4",
  "pack_id": "quickstart",
  "label": "uHOME-server Quickstart",
  "category": "operations",
  "summary": "Starter orientation pack for learning the preview, approval, and local runtime dispatch flow through uHOME-server.",
  "channels": [
    "email",
    "hubspot-sync"
  ],
  "inputs": [
    {
      "name": "server_operator_name",
      "type": "text",
      "required": true,
      "description": "Name of the operator learning the uHOME-server flow."
    },
    {
      "name": "server_goal",
      "type": "text",
      "required": true,
      "description": "The first uHOME-server workflow goal they want to try."
    }
  ],
  "outputs": [
    {
      "name": "quickstart_preview",
      "type": "preview-report",
      "description": "Small orientation preview for the first uHOME-server run path."
    },
    {
      "name": "quickstart_sync_package",
      "type": "sync-package",
      "description": "HubSpot-scoped sync package used to exercise the uHOME-server review and dispatch seam."
    }
  ],
  "approval_mode": "test-then-approve",
  "dry_run_supported": true,
  "runtime": {
    "runtime_owner": "uHOME-server",
    "execution_mode": "local-runtime-with-provider-handoff",
    "container_jobs": [
      "hubspot-sync"
    ],
    "wizard_optional": true
  },
  "assets": {
    "templates": [
      "templates/quickstart.md"
    ],
    "sample_data": [
      "sample-data/preview-input.json"
    ],
    "docs": [
      "README.md"
    ]
  },
  "provider_adapters": [
    "hubspot-sync"
  ],
  "related_binders": [
    "#binder/uhome-server-quickstart"
  ]
}
